ID	Level	Area	Name	Log Message Example	Description	Format
1BFF001D	INFO	Proxy / SMTP	spamBlocker classification unknown	SMTP message classification is unknown because an error occurred while classifying	spamBlocker was unable to classify the email message because of an error. The log message specifies the sender and recipient addresses.	"Deny 1-Trusted 0-External tcp 10.0.1.2 100.100.100.11 39524 25 msg="ProxyDeny: SMTP message classification is unknown because an error occurred while classifying" proxy_act="SMTP-Outgoing.1" sender="tester@testnet.com" recipients="wg@localhost" (SMTP-proxy-00)"
1BFF001E	INFO	Proxy / SMTP	spamBlocker exception matched	SMTP spamBlocker exception was matched	The sender or recipient of the email message matches a spamBlocker exception specified in the SMTP proxy.	"Allow 1-Trusted 0-External tcp 10.0.1.2 100.100.100.11 39476 25 msg="ProxyAvScan: SMTP spamBlocker exception" proxy_act="SMTP-Outgoing.1" rule_name="Default" content_type="" sender="tester@watchguard.com" recipients="wg@localhost" (SMTP-proxy-00)"
1BFF001F	INFO	Proxy / SMTP	Decoder error	SMTP An error was found by our decoder	The SMTP proxy was unable to decode the email message due to the error specified in the log message.	"Allow 1-Trusted 0-External tcp 10.0.55.253 100.100.100.155 36921 25 msg="ProxyStrip: SMTP An error was found by our decoder" proxy_act="SMTP-Outgoing.1" message="invalid b64 characters in input" (SMTP-OUT-00)"
1BFF0021	INFO	Proxy / SMTP	Extra pad characters in base64 encoding	SMTP extra pad characters in base64 input	The SMTP proxy encountered extra pad characters when the body of the base64-encoded message was processed.	"Allow 1-Trusted 0-External tcp 10.0.55.253 100.100.100.155 36664 25 msg="ProxyStrip: SMTP extra pad characters in base64 input" proxy_act="SMTP-Outgoing.1" pad_error="1" (SMTP-OUT-00)"
1BFF0022	INFO	Proxy / SMTP	Mail from address too long	SMTP Mail From address too long	A sender email address exceeded the configured maximum address length. The address length is unlimited by default.	"Deny 1-Trusted 0-External tcp 10.0.1.2 100.100.100.11 39497 25 msg="ProxyDeny: SMTP Mail From address too long" proxy_act="SMTP-Outgoing.1" address="senderEmailAddressIsTooLongForTheForSettings@testnet.com" length="56" response="553" (SMTP-proxy-00)"
1BFF0023	INFO	Proxy / SMTP	Application match	SMTP App match	Application Control identified the application in the mail message that is specified in the log message.	"Deny 1-Trusted 0-External tcp 10.0.1.2 100.100.100.11 39913 25 msg="ProxyDrop: SMTP App match" proxy_act="SMTP-Outgoing.1" app_cat_name="Mail and Collaboration" app_cat_id="5" app_name="SMTP" app_id="1" app_beh_name="access" app_beh_id="6" (SMTP-proxy-00)"
1BFF0024	INFO	Proxy / SMTP	DLP violation found	SMTP DLP violation Found	Data Loss Prevention (DLP) detected the rule violation that is specified in the log message.	"Allow 1-Trusted 0-External tcp 10.0.1.2 100.100.100.11 39510 25 msg="ProxyAllow: SMTP DLP violation Found" proxy_act="SMTP-Outgoing.1" dlp_sensor="PCI Audit Sensor.1" dlp_rule="SocialsecuritynumbersUSA" sender="tester@testnet.com" recipients="wg@localhost" filename="ssn.docx" (SMTP-proxy-00)"
1BFF0025	INFO	Proxy / SMTP	DLP cannot perform scan	SMTP cannot perform DLP Scan	Data Loss Prevention (DLP) is unable to scan because of the error specified in the log message.	"Allow 1-Trusted 0-External tcp 10.0.1.2 100.100.100.11 39589 25 msg="ProxyLock: SMTP cannot perform DLP scan" proxy_act="SMTP-Outgoing.1" sender="tester@testnet.com" recipients="wg@localhost" error="scan request failed" filename="message.scr" (SMTP-proxy-00)"
1BFF0026	INFO	Proxy / SMTP	DLP cannot scan object	SMTP DLP object unscannable	Data Loss Prevention (DLP) is unable to extract data from an object because the object is encrypted.	"Allow 1-Trusted 0-External tcp 10.0.1.2 100.100.100.11 39900 25 msg="ProxyAllow: SMTP DLP object unscannable" proxy_act="SMTP-Outgoing.1" dlp_sensor="PCI Audit Sensor.1" error="unscannable object (File was encrypted)" sender="tester@wgrd.com" recipients="wg@localhost" (SMTP-proxy-00)"
1BFF0027	INFO	Proxy / SMTP	DLP object too large	SMTP DLP object too large	"The file requested for Data Loss Prevention (DLP) analysis is larger than the configured limit. The default value varies by platform, from one to five MB. The log specifies the DLP sensor name and error message."	"May 30 06:36:45 2014 gary_xtmv local1.info smtp-proxy[2861]: msg_id="1BFF-0027" Allow 1-Trusted 0-External tcp 10.0.1.2 100.100.100.3 50976 25 msg="ProxyAllow: SMTP DLP oject too large" proxy_act="SMTP-Outgoing.1" sender="ghong@watchguard.com" recipients="wg@localhost" error="DLP scan limit (524288) exceeded" filename="2M-dlp-violates-end.txt" (SMTP-proxy-00)"
1BFF0028	INFO	Proxy / SMTP	APT threat detected	SMTP APT detected	APT Blocker found the threat specified in the log message in an attached file.	"Allow 1-Trusted 0-External tcp 10.0.1.2 100.100.100.11 39771 25 msg="ProxyAllow: SMTP APT detected" proxy_act="SMTP-Outgoing.1" sender="tester@wgrd.com" recipients="wg@localhost" filename="ecc59a46b439bdf63b058964e29ace0c" md5="ecc59a46b439bdf63b058964e29ace0c" task_uuid="b239bc669b534fcfa61bd78e156c9b19" threat_level="high" (SMTP-proxy-00)"
1BFF002A	INFO	Proxy / SMTP	File submitted to APT analysis server	SMTP File submitted to APT analysis server	File submitted to APT analysis server for deep threat analysis. The analysis result will be notified when the analysis result is fetched from APT analysis server.	"Allow 1-Trusted 0-External tcp 10.0.1.2 100.100.100.11 39965 25 msg="ProxyAllow: SMTP File submitted to APT analysis server" proxy_act="SMTP-Outgoing.1" sender="tester@wgrd.com" recipients="wg@localhost" filename="regex2.dll" md5="547c43567ab8c08eb30f6c6bacb479a3" task_uuid="b8517202826a43fc93dba00f9e8c30ed" (SMTP-proxy-00)"
1BFF002B	INFO	Proxy / SMTP	File reported safe from APT hash check	SMTP File reported safe from APT hash check	APT hash check did not report a threat from the object	"Allow 1-Trusted 0-External tcp 10.0.1.2 100.100.100.11 39965 25 msg="ProxyAllow: SMTP File reported safe from APT hash check" proxy_act="SMTP-Outgoing.1" sender="tester@wgrd.com" recipients="wg@localhost" filename="regex2.dll" md5="547c43567ab8c08eb30f6c6bacb479a3" task_uuid="b8517202826a43fc93dba00f9e8c30ed" (SMTP-proxy-00)"
1BFF002C	INFO	Proxy / SMTP	Protocol invalid	SMTP invalid TLS protocol	The SMTP proxy detected invalid TLS protocol.	"Deny 1-Trusted 0-External tcp 10.0.1.2 192.168.53.143 41551 465 msg="ProxyDrop: SMTP invalid TLS protocol" proxy_act="SMTP-Outgoing.1" (SMTP-proxy-00)"
2DFF0000	INFO	Proxy / TCP-UDP	Request	IP Request	TCP-UDP transaction log for the traffic that is configured to allow or deny.	"Allow ppp0 0-External tcp 10.0.1.46 206.191.171.104 49391 80 msg="IP Request" proxy_act="TCP-UDP-Proxy.Standard.1" sent_bytes="72271" rcvd_bytes="72271" src_user="testuser@Firebox-DB" (TCP-UDP-proxy-00)"
2DFF0001	INFO	Proxy / TCP-UDP	IPS match	IP IPS match	"Intrusion Prevention Service (IPS) detected an intrusion threat in TCP-UDP proxy traffic. The log message specifies the action taken, signature ID, threat severity, signature name, and signature category."	"Deny 0-External 1-Trusted udp 10.0.1.5 192.168.53.143 1025 80 msg="ProxyDrop: TCP-UDP IPS match" proxy_act="TCP-UDP-Proxy.1" signature_id="1110070" severity="4" signature_name="DOS Apache mod_ssl HTTPS Request DOS -1" signature_cat="Dos/DDoS" (TCP-UDP-proxy-00)"
2DFF0004	INFO	Proxy / TCP-UDP	Protocol	IP protocol	"The TCP-UDP proxy recognized the protocol. The log message specifies the action taken, and the rule name."	"Allow 1-Trusted 0-External tcp 10.0.1.2 91.189.95.36 53246 80 msg="ProxyReplace: IP protocol" proxy_act="TCP-UDP-Proxy.1" rule_name="HTTP-Client.1" new_action="HTTP-Client.1" (TCP-UDP-proxy-00)"
2DFF0005	INFO	Proxy / TCP-UDP	Application match	IP App match	"Application Control identified the application type from the TCP-UDP proxy traffic. The log message specifies the action taken, the application name and ID, the application category name and ID, and the application behavior and ID."	"Allow 1-Trusted 0-External udp 10.0.1.3 4.2.2.1 63690 53 msg="ProxyAllow: IP App match" proxy_act="TCP-UDP-Proxy.1" app_cat_name="Network Management" app_cat_id="9" app_name="DNS" app_id="61" app_beh_name="access" app_beh_id="6" (TCP-UDP-proxy-00)"
