ID	Level	Area	Name	Log Message Example	Description	Format
22FF000F	INFO	Proxy / IMAP	spamBlocker bulk mail	IMAP Classified as bulk mail	spamBlocker classified the message as bulk mail. The log message specifies the user-related information	"Allow 1-Trusted 0-External tcp 10.0.1.3 100.100.100.3 60275 143 msg="ProxyReplace: IMAP Classified as bulk mail" proxy_act="IMAP-Client.Standard.1" mbx="INBOX" user="wg" (IMAP-proxy-00)"
22FF0010	INFO	Proxy / IMAP	spamBlocker suspect spam	IMAP Classified as suspect SPAM	spamBlocker classified the message as suspect SPAM. The log message specifies the user-related information	"Allow 1-Trusted 0-External tcp 10.0.1.3 100.100.100.3 60275 143 msg="ProxyReplace: IMAP Classified as suspect SPAM" proxy_act="IMAP-Client.Standard.1" mbx="INBOX" user="wg" (IMAP-proxy-00)"
22FF0011	INFO	Proxy / IMAP	spamBlocker not scored	IMAP Message could not be scored	spamBlocker cannot score the message. The log message specifies the user-related information	"Allow 1-Trusted 0-External tcp 10.0.1.3 100.100.100.3 60275 143 msg="ProxyAllow: IMAP Message could not be scored" proxy_act="IMAP-Client.Standard.1" mbx="INBOX" user="wg" (IMAP-proxy-00)"
22FF0012	INFO	Proxy / IMAP	spamBlocker exception matched	IMAP spamBlocker exception was matched	The sender for the email matched a spamBlocker exception rule. The log message specifies the rule and user-related information.	"Allow 1-Trusted 0-External tcp 10.0.1.3 100.100.100.3 60275 143 msg="ProxyAllow: IMAP spamBlocker exception was matched" proxy_act="IMAP-Client.Standard.1" mbx="INBOX" user="wg" (IMAP-proxy-00)"
22FF0013	INFO	Proxy / IMAP	spamBlocker not spam	IMAP Classified as not SPAM	spamBlocker classified the message as not SPAM. The log message specifies the user-related information.	"Allow 1-Trusted 0-External tcp 10.0.1.3 100.100.100.3 60275 143 msg="ProxyAllow: IMAP Classified as not SPAM" proxy_act="IMAP-Client.Standard.1" mbx="INBOX" user="wg" (IMAP-proxy-00)"
22FF0014	INFO	Proxy / IMAP	spamBlocker not spam	IMAP Message classification is unknown because an error occurred while classifying	spamBlocker was unable to classify the message because of the error specified in the log message. The log message specifies the user-related information.	"Allow 1-Trusted 0-External tcp 10.0.1.3 100.100.100.3 60275 143 msg="ProxyAllow: IMAP Message classification is unknown because an error occurred while classifying" proxy_act="IMAP-Client.Standard.1" mbx="INBOX" user="wg" (IMAP-proxy-00)"
22FF0015	INFO	Proxy / IMAP	GAV file too large	IMAP Gateway AV object too large	The attachment file size exceeds the Gateway AV scan size limit.	"Allow 1-Trusted 0-External tcp 10.0.1.3 100.100.100.3 50698 143 msg="ProxyAllow: IMAP Gateway AV object too large" proxy_act="IMAP-Client.OUT" attachment="large_file.doc" error="File exceeding the scan size limit" mbx="INBOX" user="wg" (IMAP-proxy-00)"
22FF0016	INFO	Proxy / IMAP	GAV file encrypted	Gateway AV object encrypted (password-protected)	The attachment file is encrypted or password-protected.	"Allow 1-Trusted 0-External tcp 10.0.1.3 100.100.100.3 50698 143 msg="ProxyAllow: IMAP Gateway AV object enrcypted (password-protected)" proxy_act="IMAP-Client.OUT" attachment="password-protected.zip" error="Object Encrypted" mbx="INBOX" user="wg" (IMAP-proxy-00)"
22FF1017	INFO	Proxy / IMAP	Protocol invalid	IMAP invalid TLS protocol	The IMAP proxy detected invalid TLS protocol.	"Deny 1-Trusted 0-External tcp 10.0.1.2 192.168.53.143 41551 993 msg="ProxyDrop: IMAP invalid TLS protocol" proxy_act="IMAP-Client.1" (IMAP-proxy-00)"
22FF1018	INFO	Proxy / IMAP	Content Inspection	IMAP TLS content inspection	The IMAP proxy decrypted a secure connection for content inspection.	"Deny 1-Trusted 0-External tcp 10.0.1.2 192.168.53.143 41551 993 msg="ProxyInspect: IMAP TLS content inspection" proxy_act="IMAP-Client.1" server_ssl="ECDHE-RSA-AES256-SHA384" client_ssl="ECDHE-RSA-AES256-GCM-SHA384" (IMAP-proxy-00)"
21FF0000	INFO	Proxy / POP3	CAPA	POP3 CAPA	The CAPA response contained the unknown or blocked capability that is specified in the log message.	"Deny 1-Trusted 0-External tcp 10.0.1.2 100.100.100.11 43924 110 msg="ProxyDeny: POP3 CAPA" keyword="VERF": (POP3-proxy-00)"
21FF0001	INFO	Proxy / POP3	Authentication	POP3 AUTH	"The authentication type matched a rule, or the default rule of no match. The log message specifies the rule name and authentication type."	"Deny 1-Trusted 0-External tcp 10.0.1.2 100.100.100.11 44047 110 msg="ProxyDeny: POP3 AUTH" proxy_act="POP3-Client.2" rule_name="Default" authtype="KERBOSE_V12" (POP3-proxy-00)"
21FF0002	INFO	Proxy / POP3	Command	POP3 command	The client sent an authentication command when it was not allowed.	"Deny 1-Trusted 0-External tcp 10.0.1.2 100.100.100.11 44225 110 msg="ProxyDeny: POP3 command" proxy_act="POP3-Client.2" keyword="AUTH KERBEROS_V12\x0d\x0a" (POP3-proxy-00)"
21FF0005	INFO	Proxy / POP3	Header	POP3 header	"A POP3 header matched a configured Header rule, or the default rule of no match. The log message specifies the rule and header."	"Allow 1-Trusted 0-External tcp 10.0.1.2 100.100.100.11 43909 110 msg="ProxyStrip: POP3 header" proxy_act="POP3-Client.1" rule_name="Default" header="Delivered-To:Êwg@localhost" (POP3-proxy-00)"
21FF0006	INFO	Proxy / POP3	Content type	POP3 content type	"A MIME-type matched a configured content type rule, or the default rule of no match. The log message specifies the rule, MIME-type, and user name."	"Allow 1-Trusted 0-External tcp 10.0.1.2 100.100.100.11 43909 110 msg="ProxyAllow: POP3 content type" proxy_act="POP3-Client.1" rule_name="All text types" content_type="text/plain" user="wg" (POP3-proxy-00)"
21FF0007	INFO	Proxy / POP3	File name	POP3 filename	"The attachment matches a configured file name rule, or the default rule of no match. The log message specifies the rule, file name, and user name."	"Allow 1-Trusted 0-External tcp 10.0.1.2 100.100.100.11 44035 110 msg="ProxyAvScan: POP3 filename" proxy_act="POP3-Client.1" rule_name="Text files" file_name="high-triggerme.txt" user="wg" (POP3-proxy-00)"
21FF0009	INFO	Proxy / POP3	Timeout	POP3 timeout	The connection was idle for longer than the configured timeout limit. The default limit is 1 minute.	"Deny 1-Trusted 0-External tcp 10.0.1.2 100.100.100.11 44042 110 msg="ProxyDeny: POP3 timeout" proxy_act="POP3-Client.1" timeout="180" (POP3-proxy-00)"
21FF000A	INFO	Proxy / POP3	Request	POP3 request	"This audit log message specifies the bytes sent, bytes received, and user."	"Allow 1-Trusted 0-External tcp 10.0.1.2 100.100.100.11 43909 110 msg="POP3 request" proxy_act="POP3-Client.1" rcvd_bytes="625052" sent_bytes="1433" user="wg" (POP3-proxy-00)"
21FF000C	INFO	Proxy / POP3	IPS match	POP3 IPS match	"Intrusion Prevention Service (IPS) detected an intrusion threat. The log message specifies the action taken, the signature ID, threat severity, signature name, and signature category."	"Deny 0-External 1-Trusted tcp 172.16.180.2 172.16.181.2 1024 25 msg="ProxyDrop: POP3 IPS match" proxy_act="POP3-Incoming.1" signature_id="1110401" severity="4" signature_name="EXPLOIT IBM Lotus Notes Lotus 1-2-3 Work Sheet File Viewer Buffer Overflow (CVE-2007-6593)" signature_cat="Buffer Over Flow" (POP3-proxy-00)"
21FF000F	INFO	Proxy / POP3	GAV Virus found	POP3 Virus found	"Gateway AntiVirus detected a virus or malware in the file. The log message specifies the virus name, user, and file name."	"Allow 1-Trusted 0-External tcp 10.0.1.2 100.100.100.11 44042 110 msg="ProxyAllow: POP3 Virus found" proxy_act="POP3-Client.1" user="wg" filename="sample.apt" virus="Generic34.EFX" (POP3-proxy-00)"
21FF0010	INFO	Proxy / POP3	GAV cannot perform scan	POP3 cannot perform Gateway AV	Gateway AntiVirus (GAV) failed to scan because of the error specified in the log message.	"Allow 1-Trusted 0-External tcp 10.0.1.2 100.100.100.11 39589 25 msg="ProxyLock: POP3 Cannot perform Gateway AV scan" proxy_act="POP3-Client.1" user="wg" filename="message.scr" error="scan request failed" (POP3-proxy-00)"
21FF0012	INFO	Proxy / POP3	Line length too long	POP3 line length too long	"A line exceeds the configured limit. The default is 1,000 bytes. The log message specifies the line length."	"Deny 1-Trusted 0-External tcp 10.0.1.2 100.100.100.11 39457 25 msg="ProxyDeny: POP3 line length too long" proxy_act="POP3-Client.1" line_length="22121" (POP3-proxy-00)"
21FF0014	INFO	Proxy / POP3	Message format	POP3 message format	The message is not in an allowed format. The log message specifies the error and the user.	"Allow 1-Trusted 0-External tcp 10.0.1.2 100.100.100.11 44061 110 msg="ProxyStrip: POP3 message format" proxy_act="POP3-Client.2" file_name="sm_conns.txt" type="uuencode" (POP3-proxy-00)"
21FF0015	INFO	Proxy / POP3	Encoding error	POP3 encoding error	The proxy was unable to decode and encode the message because of the error specified in the log message.	"Allow 0-External 1-Trusted tcp 100.100.106.253 100.100.106.55 51064 110 msg="ProxyStrip: POP3 encoding error" proxy_act="POP3-Server.1" message="invalid b64 characters in input" (POP3-IN-00)"
21FF0016	INFO	Proxy / POP3	spamBlocker confirmed spam	POP3 Classified as confirmed SPAM	spamBlocker classified the message as confirmed SPAM. The log message specifies the sender and recipients.	"Allow 1-Trusted 0-External tcp 10.0.55.253 100.100.100.155 45551 110 msg="ProxyReplace: POP3 Classified as confirmed SPAM" (POP3-OUT-00)"
21FF0017	INFO	Proxy / POP3	spamBlocker BULK spam	POP3 Classified as suspect SPAM	spamBlocker classified the message as bulk SPAM. The log message specifies the sender and recipients.	"Allow 0-External 1-Trusted tcp 100.100.106.253 100.100.106.55 46177 110 msg="ProxyReplace: POP3 Classified as suspect SPAM" (POP3-IN-00)"
21FF0018	INFO	Proxy / POP3	spamBlocker suspect spam	POP3 Classified as suspect SPAM	spamBlocker classified the message as suspect SPAM. The log message specifies the sender and recipients.	"Allow 1-Trusted 0-External tcp 10.0.1.2 100.100.100.11 44249 110 msg="ProxyReplace: POP3 Classified as suspect SPAM" (POP3-proxy-00)"
21FF001A	INFO	Proxy / POP3	spamBlocker exception matched	POP3 spamBlocker exception was matched	"The sender for the email matched a spamBlocker exception rule. The log message specifies the sender, recipient, and subject."	"Allow 1-Trusted 0-External tcp 10.0.1.2 100.100.100.11 43913 110 msg="ProxyAllow: POP3 spamBlocker exception was matched" proxy_act="POP3-Client.1" from="tester@testnet.com" to="wg@localhost" subj_tag="(none)" (POP3-proxy-00)"
21FF001B	INFO	Proxy / POP3	spamBlocker not spam	POP3 Classified as not SPAM	spamBlocker classified the message as not SPAM. The log message specifies the sender and recipients.	"Allow 1-Trusted 0-External tcp 10.0.1.2 100.100.100.11 43924 110 msg="ProxyAllow: POP3 Classified as not SPAM" (POP3-proxy-00)"
21FF001C	INFO	Proxy / POP3	spamBlocker classification unknown	POP3 message classification is unknown because an error occurred while classifying	spamBlocker was unable to classify the message because of the error specified in the log message.	"Allow 1-Trusted 0-External tcp 10.0.55.253 100.100.100.155 53776 110 msg="ProxyAllow: POP3 message classification is unknown because an error occurred while classifying" (POP3-OUT-00)"
21FF001D	INFO	Proxy / POP3	Extra pad characters	POP3 extra pad characters in base64 input	The POP3 proxy encountered extra pad characters in the body of a base64-encoded message.	"Allow 0-External 1-Trusted tcp 100.100.106.253 100.100.106.55 46177 110 msg="ProxyStrip: POP3 Extra pad characters in base64 input" proxy_act="POP3-Server.1" pad_error="1" (POP3-IN-00)"
21FF001E	INFO	Proxy / POP3	Application match	POP3 App match	"Application Control identified the application from the email message. The log specifies the application name and ID, application category and ID, and the application behavior name and ID."	"Allow 1-Trusted 0-External tcp 10.0.1.2 100.100.100.11 44042 110 msg="ProxyAllow: POP3 App match" proxy_act="POP3-Client.1" app_cat_name="Mail and Collaboration" app_cat_id="5" app_name="POP3" app_id="2" app_beh_name="communicate" app_beh_id="2" (POP3-proxy-00)"
21FF001F	INFO	Proxy / POP3	APT threat detected	POP3 APT detected	APT Blocker found the threat specified in the log message in an attached file.	"Deny 1-Trusted 0-External tcp 10.0.1.2 100.100.100.3 47193 110 msg="ProxyDrop: POP3 APT detected" proxy_act="POP3-Client.Standard.1" user="wg" filename="971d3aa1c683c69f425cc6ddf66833d3d172f0fd.apk" md5="7abebcf53e97b586c92a9ce5b9985cd4" task_uuid="e8a3730d1f88491c8821712e85d94929" threat_level="high" (POP3-proxy-00)"
21FF0021	INFO	Proxy / POP3	File submitted to APT analysis server	POP3 File submitted to APT analysis server	File submitted to APT analysis server for deep threat analysis. The analysis result will be notified when the analysis result is fetched from APT analysis server.	"Allow 1-Trusted 0-External tcp 10.0.1.2 100.100.100.3 47187 110 msg="ProxyAllow: POP3 File submitted to APT analysis server" proxy_act="POP3-Client.Standard.1" user="wg" filename="971d3aa1c683c69f425cc6ddf66833d3d172f0fd.apk" md5="7abebcf53e97b586c92a9ce5b9985cd4" task_uuid="e8a3730d1f88491c8821712e85d94929" (POP3-proxy-00)"
21FF0022	INFO	Proxy / POP3	File reported safe from APT hash check	POP3 File reported safe from APT hash check	APT hash check did not report a threat from the object	"Allow 1-Trusted 0-External tcp 10.0.1.2 100.100.100.3 47187 110 msg="ProxyAllow: POP3 File reported safe from APT hash check" proxy_act="POP3-Client.Standard.1" user="wg" filename="971d3aa1c683c69f425cc6ddf66833d3d172f0fd.apk" md5="7abebcf53e97b586c92a9ce5b9985cd4" task_uuid="e8a3730d1f88491c8821712e85d94929" (POP3-proxy-00)"
28FF0000	INFO	Proxy / SIP	Timeout	SIP timeout	The connection was idle for longer than the configured timeout value. The default value is 180 seconds.	"Deny 1-Trusted 0-External udp 10.0.1.5 192.168.53.143 5060 5060 msg="ProxyDrop: SIP timeout" (SIP-ALG-00)"
28FF0004	INFO	Proxy / SIP	Request	SIP request	The log message specifies the source and destination of the allowed call.	"Allow 1-Trusted 0-External udp 10.0.1.3 192.168.53.143 5060 5060 msg="SIP request" proxy_act="SIP-Client.1" call_from="10.0.1.3" call_to="192.168.53.143" (SIP-ALG-00)"
28FF0005	INFO	Proxy / SIP	Codec	SIP codec	The codec is allowed or denied based on the setting for Denied Codecs in the SIP policy.	"Deny 1-Trusted 0-External udp 10.0.1.3 192.168.53.143 5060 5060 msg="ProxyDeny: SIP codec" proxy_act="SIP-Client.1" codec="speex" (SIP-ALG-00)"
28FF0006	INFO	Proxy / SIP	Access control	SIP Access control	"The header address is allowed or denied based on the Access Control settings. The log message specifies the action taken, header and message ID."	"Allow 1-Trusted 0-External udp 10.0.1.3 192.168.53.143 5060 5060 msg="ProxyAllow: SIP Access control" proxy_act="SIP-Client.1" To-header="zoolvb1@192.168.53.143" (SIP-ALG-00)"
28FF0008	INFO	Proxy / SIP	IPS match	SIP IPS match	"Intrusion Prevention Service (IPS) detected an intrusion threat. The log message specifies the signature ID, threat severity, signature name, signature category, destination host name and URI path."	"Deny 0-External 1-Trusted udp 10.0.1.5 192.168.53.143 5060 5060 msg="ProxyDrop: SIP IPS match" proxy_act="SIP-Client.1" signature_id="1057422" severity="4" signature_name="SIP Digium Asterisk SIP SDP Header Parsing Stack Buffer Overflow -1" signature_cat="Buffer Over Flow" (SIP-ALG-00)"
28FF0009	INFO	Proxy / SIP	Application match	SIP App match	"Application Control identified an application from the transaction. The log message specifies the action taken, the application name and ID, application category name and ID, and the application behavior name and ID."	"Deny 1-Trusted 0-External udp 10.0.1.4 192.168.53.143 5060 5060 msg="ProxyDrop: SIP App match" proxy_act="SIP-Client.1" signature_id="12" app_name="SIP" beh_name="communicate" app_msg="Application matched. application name: SIP; behavior name:communicate" (SIP-ALG-00)"
1BFF0000	INFO	Proxy / SMTP	Greeting	SMTP greeting	"The host name in the SMTP proxy HELO or EHLO command matched one of the Greeting Rules, or the default rule of no match."	"Deny 1-Trusted 0-External tcp 10.0.1.2 100.100.100.11 39366 25 msg="ProxyDeny: SMTP greeting" proxy_act="SMTP-Outgoing.1" rule_name="*.test.net" hostname="testbox.test.net" (SMTP-proxy-00)"
1BFF0001	INFO	Proxy / SMTP	ESMTP option	SMTP ESMTP option	The EHLO response from the SMTP server includes an ESMTP option that is disabled or unknown.	"Allow 1-Trusted 0-External tcp 10.0.1.2 100.100.100.11 39371 25 msg="ProxyStrip: SMTP ESMTP option" proxy_act="SMTP-Outgoing.1" keyword="VRFY" (SMTP-proxy-00)"
1BFF0002	INFO	Proxy / SMTP	Authentication (AUTH)	SMTP AUTH	"The EHLO response from the SMTP server included an authentication type that matches a configured authentication rule. The log message specifies the proxy action, the rule name, the action taken, and the authentication type."	"Deny 1-Trusted 0-External tcp 10.0.1.2 100.100.100.11 39374 25 msg="ProxyDeny: SMTP AUTH" proxy_act="SMTP-Outgoing.1" rule_name="PLAIN" authtype="PLAIN" (SMTP-proxy-00)"
1BFF0003	INFO	Proxy / SMTP	Header	SMTP header	"A MIME header matched a configured rule, or the default rule of no match."	"Allow 1-Trusted 0-External tcp 10.0.1.2 100.100.100.11 39379 25 msg="ProxyStrip: SMTP header" proxy_act="SMTP-Outgoing.1" rule_name="Default" header="X-MimeOLE: Produced By Microsoft Exchange V6.0.6603.0" (SMTP-proxy-00)"
1BFF0004	INFO	Proxy / SMTP	From address	SMTP From address	The sender address matched a rule specified in the Mail From rules.	"Deny 1-Trusted 0-External tcp 10.0.1.2 100.100.100.11 39383 25 msg="ProxyDeny: SMTP From address" proxy_act="SMTP-Outgoing.1" rule_name="jsmith@*.com->ex-employee" address="dbonn@testnet.com" (SMTP-proxy-00)"
1BFF0005	INFO	Proxy / SMTP	To address	SMTP To address	The recipient address matched a rule specified in the Rcpt To rules.	"Deny 1-Trusted 0-External tcp 10.0.1.2 100.100.100.11 39384 25 msg="ProxyDeny: SMTP To address" proxy_act="SMTP-Outgoing.1" rule_name="Default" address="tester@testnet.com" (SMTP-proxy-00)"
1BFF0006	INFO	Proxy / SMTP	Content type	SMTP content type	Some of the message content matched a content filter rule.	"Allow 1-Trusted 0-External tcp 10.0.1.2 100.100.100.11 39391 25 msg="ProxyAvScan: SMTP content type" proxy_act="SMTP-Outgoing.1" rule_name="Default" content_type="application/x-gzip" sender="tester@testnet.com" recipients="wg@localhost" (SMTP-proxy-00)"
1BFF0007	INFO	Proxy / SMTP	Filename	SMTP filename	"An email attachment matched a file name rule, or the attachment is uuencoded and the SMTP proxy allows uuencoded attachments."	"Allow 1-Trusted 0-External tcp 10.0.1.2 100.100.100.11 39436 25 msg="ProxyStrip: SMTP filename" proxy_act="SMTP-Outgoing.1" rule_name="*.exe" file_name="app.exe" sender="tester@testnet.com" recipients="wg@localhost" (SMTP-proxy-00)"
1BFF000A	INFO	Proxy / SMTP	Timeout	SMTP timeout	The SMTP connection was idle for longer than the configured idle timeout limit. The default is 10 minutes.	"Deny 1-Trusted 0-External tcp 10.0.1.2 100.100.100.11 39402 25 msg="ProxyDeny: SMTP timeout" proxy_act="SMTP-Outgoing.1" timeout="60" (SMTP-proxy-00)"
1BFF000C	INFO	Proxy / SMTP	GAV Virus found	SMTP Virus found	Gateway AntiVirus (GAV) detected a virus or malware in an email attachment.	"Allow 1-Trusted 0-External tcp 10.0.1.2 100.100.100.11 39445 25 msg="ProxyStrip: SMTP Virus found" proxy_act="SMTP-Outgoing.1" sender="tester@testnet.com" recipients="wg@localhost" virus="I-Worm/Netsky.CORRUPTED" filename="message.scr" (SMTP-proxy-00)"
1BFF000E	INFO	Proxy / SMTP	GAV cannot perform scan	SMTP cannot perform Gateway AV scan	Gateway AntiVirus (GAV) could not complete the scan because of the error that is specified in the log message.	"Allow 1-Trusted 0-External tcp 10.0.1.2 100.100.100.11 39589 25 msg="ProxyLock: SMTP cannot perform Gateway AV scan" proxy_act="SMTP-Outgoing.1" sender="tester@testnet.com" recipients="wg@localhost" error="scan request failed" filename="message.scr" (SMTP-proxy-00)"
1BFF000F	INFO	Proxy / SMTP	Request	SMTP request	"This SMTP audit log specifies the bytes sent, bytes received, the sender and recipient addresses, and the sender and recipient TLS cipher."	"Allow 1-Trusted 0-External tcp 10.0.1.2 100.100.100.11 39398 25 msg="SMTP request" proxy_act="SMTP-Outgoing.1" rcvd_bytes="272" sent_bytes="282" sender="tester@testnet.com" recipients="wg@localhost" server_ssl="ECDHE-RSA-AES256-GCM-SHA384" client_ssl="AES128-SHA256" tls_profile="TLS-Client.Standard"(SMTP-proxy-00)"
1BFF0010	INFO	Proxy / SMTP	Message format	SMTP message format	The email message format matched a message format rule specified in the SMTP proxy. The log message includes the error message.	"Deny 1-Trusted 0-External tcp 10.0.1.2 100.100.100.11 39452 25 msg="ProxyDeny: SMTP message format" proxy_act="SMTP-Outgoing.1" file_name="sm_conns.txt" type="uuencode" sender="tester@testnet.com" recipients="wg@localhost" (SMTP-proxy-00)"
1BFF0011	INFO	Proxy / SMTP	IPS match	SMTP IPS match	"Intrusion Prevention Service (IPS) detected a threat. The log message specifies the signature name and ID, threat severity, and signature category."	"Deny 0-External 1-Trusted tcp 172.16.180.2 172.16.181.2 1024 25 msg="ProxyDrop: SMTP IPS match" proxy_act="SMTP-Incoming.1" signature_id="1110401" severity="4" signature_name="EXPLOIT IBM Lotus Notes Lotus 1-2-3 Work Sheet File Viewer Buffer Overflow (CVE-2007-6593)" signature_cat="Buffer Over Flow" (SMTP-proxy-00)"
1BFF0013	INFO	Proxy / SMTP	Too many recipients	SMTP too many recipients	The number of email recipients specified in the email message exceeds the configured limit. The default limit is 99 for inbound messages and unlimited for outbound messages. The log message specifies the proxy action and number of recipients.	"Allow 1-Trusted 0-External tcp 10.0.1.2 100.100.100.11 39404 25 msg="ProxyDeny: too many recipients" proxy_act="SMTP-Outgoing.1" rule_name="Default" content_type="" sender="tester@testnet.com" recipients="wg1@tenet.com;wg2@testnet.com" (SMTP-proxy-00)"
1BFF0014	INFO	Proxy / SMTP	Response size too long	SMTP response size too long	"The SMTP server response exceeds the configured limit. The default limit is 10,000 KB. The log message specifies the size of the response."	"Deny 1-Trusted 0-External tcp 10.0.1.2 100.100.100.11 39973 25 msg="ProxyDeny: SMTP response size too long" proxy_act="SMTP-Outgoing.1" response_size="5030" (SMTP-proxy-00)"
1BFF0015	INFO	Proxy / SMTP	Line too long	SMTP line length too long	"The email message contains a line that exceeds the configured limit. The default is 1,000 bytes. The log message specifies the line length."	"Deny 1-Trusted 0-External tcp 10.0.1.2 100.100.100.11 39457 25 msg="ProxyDeny: SMTP line length too long" proxy_act="SMTP-Outgoing.1" line_length="32110" (SMTP-proxy-00)"
1BFF0016	INFO	Proxy / SMTP	Message too long	SMTP message size too long	"The SMTP message length exceeds the configured limit. The default limit is 10,000 kb."	"Deny 1-Trusted 0-External tcp 10.0.1.2 100.100.100.11 39466 25 msg="ProxyDeny: SMTP message size too long" proxy_act="SMTP-Outgoing.1" size="16384" (SMTP-proxy-00)"
1BFF0017	INFO	Proxy / SMTP	Header too long	SMTP header size too long	"The SMTP message contains a header that exceeds the configured Maximum Header Length. The default is 20,000 bytes."	"Deny 1-Trusted 0-External tcp 10.0.1.2 100.100.100.11 39473 25 msg="ProxyDeny: SMTP header size too long" proxy_act="SMTP-Outgoing.1" headers_size="12157" (SMTP-proxy-00)"
1BFF0018	INFO	Proxy / SMTP	Command	SMTP command	"The SMTP request contains a command that is not supported or is not valid for the email transaction. The log message specifies the proxy action, action taken, SMTP command, and the response code."	"Deny 1-Trusted 0-External tcp 10.0.1.2 100.100.100.11 39474 25 msg="ProxyDeny: SMTP command" proxy_act="SMTP-Outgoing.1" keyword="VERIFY\x0d\x0a" response="500" (SMTP-proxy-00)"
1BFF0019	INFO	Proxy / SMTP	spamBlocker confirmed spam	SMTP Classified as confirmed SPAM	"spamBlocker has classified the message as confirmed SPAM. The log message specifies the proxy action, the action taken, and the sender and recipient addresses."	"Deny 1-Trusted 0-External tcp 10.0.1.2 100.100.100.11 39446 25 msg="ProxyDeny: SMTP Classified as confirmed SPAM" proxy_act="SMTP-Outgoing.1" sender="tester@testnet.com" recipients="wg@localhost" (SMTP-proxy-00)"
1BFF001A	INFO	Proxy / SMTP	spamBlocker bulk spam	SMTP Classified as bulk mail	"spamBlocker has classified the message as bulk SPAM. The log message specifies the proxy action, the action taken, and the sender and recipient addresses."	"Allow 1-Trusted 0-External tcp 10.0.1.2 100.100.100.11 39499 25 msg="ProxyReplace: SMTP Classified as bulk mail" proxy_act="SMTP-Outgoing.1" sender="tester@testnet.com" recipients="wg@localhost" (SMTP-proxy-00)"
1BFF001B	INFO	Proxy / SMTP	spamBlocker suspect spam	SMTP Classified as suspect SPAM	"spamBlocker has classified the message as suspect SPAM. The log message specifies the proxy action, the action taken, and the sender and recipient addresses."	"Allow 1-Trusted 0-External tcp 10.0.1.2 100.100.100.11 39999 25 msg="ProxyAllow: SMTP Classified as suspect SPAM" proxy_act="SMTP-Outgoing.1" sender="tester@wgrd.com" recipients="wg@localhost" (SMTP-proxy-00)"
1BFF001C	INFO	Proxy / SMTP	spamBlocker not SPAM	SMTP Classified as not SPAM	"spamBlocker has classified the message as not SPAM. The log message specifies the proxy action, the action taken, and the sender and recipient addresses."	"Allow 1-Trusted 0-External tcp 10.0.1.2 100.100.100.11 39487 25 msg="ProxyAllow: SMTP Classified as not SPAM" proxy_act="SMTP-Outgoing.1" sender="tester@testnet.com" recipients="wg@localhost" (SMTP-proxy-00)"
